"v t e Mars Exploration Rover (MER) program","v t e Mars Exploration Rover (MER) program","v t e Mars Exploration Rover (MER) program"
"General","Spirit rover (MER-A) Opportunity rover (MER-B) Scientific information",""
"Spirit rover , URL: /wiki/Spirit_(rover)
","Gusev crater Surface features of Mars imaged by Spirit Surface features visited",""
"Opportunity rover , URL: /wiki/Opportunity_(rover)
","Timeline Meridiani Planum Argo crater Eagle crater Endeavour crater Surface features of Mars imaged by Opportunity Surface features visited",""
"Instruments","APXS Cameras (Hazcam, Navcam, Pancam, Microscopic Imager) MIMOS II Mini-TES Rock Abrasion Tool (RAT) Rover embedded computers MarsDial (Calibration Target/Plauque)",""
"Related","Computers (IBM RAD6000) DSN JPL Maestro Rocker-bogie Rockets (Delta II Heavy) Cleaning event 37452 Spirit 39382 Opportunity Roving Mars (2006 documentary) Good Night Oppy (upcoming documentary) Exploration of Mars",""
